Time,Speaker,Text
28:12,Sanyam Bhutani,"Okay. So in the people you mentioned running the quote unquote optimization code like which is which compresses the model takes around one day on a V 100 GPU for the audience like, could you help us how understand how long is this compared to like the other approaches we were just talking about?"
28:30,Pierre Stock,"Yeah, of course. So, yes, sometimes people can obviously wait when, when thinking about training times. So, let's say that, in general, as a general guideline training model takes like a couple of days and a couple of us so it's pretty pretty reason that they give us some examples."
28:54,Sanyam Bhutani,But an excellent totally out of the picture. It takes a few days later.
28:58,Pierre Stock,"Yeah, of course. trainer Resnets"
29:02,Pierre Stock,"is next on image net unlike edge GPUs, it was like one day we're not two days What is your to train a very large NLP model with huge transformers and a huge data set can take up to one or two weeks you think of, for example, on the contrary, what people must realize is that the training of smoke admits on the site of death, for example, takes like less than a year to prototyping and this training this model and this particular sentence I for 10 years ago to like, you know, data. So it's interesting to see the progress of as the progress progress has been made."
29:47,Sanyam Bhutani,"So, after compressing Do you think you mentioned the code base that we cannot influence on the CPU and GPU does like the company's model have, like equivalent influence time or do you see a difference when doing that?"
30:00,Pierre Stock,"So, for the moment, inference from channel is not a proof of concept. So the version I just read instantiate the whole networks was an uncompressed networked. lazed was the centroids. And the assignments, first time is the one of like a non compressed resonator until you are introduced or CD security story, of course, what as a thought of as a future Walker, what you can do is that do the inference model in a more clever way, meaning that it was the centuries or you can claim it to play them with the explanations. And then this user and user summations are using the assignments. The most fastest, faster way to do so, without instead sending the winners but because of course, it's it's useless and the mobile device"
30:49,Pierre Stock,is more proof of concept for the moment. Okay.
30:53,Sanyam Bhutani,"curious about your thoughts, maybe maybe unbiased thoughts on pytorch. So what do you think about the framework and I'd also like to point out a little early detail that I noticed, I think it was issued at the cutting edge version, right. So it was opposed to was in back in the day when I think that was the cutting edge version of it. It's"
31:14,Pierre Stock,"basically,"
31:16,Pierre Stock,basically a dash is amazing. So it's an unbiased
31:22,Sanyam Bhutani,totally with you on that.
31:24,Pierre Stock,"But I would say that most for quick prototyping you you should know by Donna. And also it allows you to scale things up to production. So both of those aspects are committed in one single frameworks, which it's amazing if you check to check out the the websites and the tutorials. Of course at fair we are very supportive. And we also add with the beta beta version. So it really is a beta version came out when I was doing my internship I remember like, only two days ago, today's tutorial sorry And basically, we had to buy a dog food exertional. But I would say a huge tag to a huge thanks to the Dutch team because they are amazing. And they are working so quick. Yeah, so it's definitely switching that I know Adam pesco I think that mean you're incredible Walker. So thanks to them, maybe"
32:26,Sanyam Bhutani,"even I think the community I'm sure is very thankful to them. I'm also curious does like is does fear help? pytorch also, how does the process work? So because I'm sure the research will contribute two fighters to like, is it also driven by FAIR research?"
32:42,Pierre Stock,"So I think we had two ways on the first day that three months specific features for our reception. For example, there wasn't a festival. Yes, there wasn't. I think the best way it was found the Phils invention 1.0 I think maybe I'm wrong, but the I think at some point we integrated the first one because we needed it. So important, the first point is incorporating features. The second point is just getting by dodgy exposition. Because when you open source code that's of course in by doctrine, which makes it such as a mess kassian in benchmark, face"
33:22,Pierre Stock,FastText and so ever
33:25,Pierre Stock,we write a lot of the code in PyTorch and that's a lot of DL in PyTorch.
33:33,Sanyam Bhutani,"Okay, going back to research a bit, so I'm I want to know like the, in all of your preprints you've had multiple authors. So could you tell us how does a research situation in like a multiple paper author look like? So how do you like, invite other researchers and distribute your work among them?"
33:53,Pierre Stock,"Yeah, so it's a"
33:56,Pierre Stock,it's a basically
33:59,Pierre Stock,"So first of all, I have to thank my collaborators Of course because without them I couldn't have done anything physically. So I asked three, three advisors and so in every investor now on the paper and as he goes out my advisors do they all live in during the paper. We also worked with our model, which is also its favor and already add experience in your network compression. wizardry was it called fast text? So four sentence sentence. It's amazing. So we invert, the work was quite mature and so fruitful. And regarding the older we generally the, you put the researchers that are the idea. agenda was the most the most new one now. And then beginning you put the ones that contributed most of most of the project, they basically look together. Bunch of lots of subtleties are in the field. But when disease observers again lines, okay?"
35:07,Sanyam Bhutani,"How do you like, just out of curiosity? So I know about differently but in our research so how do you like distribute the collaborative effort? It depends on the experience or how does that work?"
35:19,Pierre Stock,"Yeah, independent area under the collaborator."
35:24,Pierre Stock,"As a general guideline, I would say that the most senior ones are"
35:29,Pierre Stock,"basically don't code that much. Because they want to code but they don't have the time basically, because of supervise many projects on so they are not on the storytelling side, and also under basic agency ideas, which is a kind of never important so also 1818 writings of paper because everything experienced to do so. And the first, first or thousands of paper, have more enzone experience with the decoder. Okay."
35:59,Pierre Stock,I know And the results in the internal code Okay.
36:08,Sanyam Bhutani,"Now slightly shifting so you harder like, as he said a quote unquote traditional background Do you think and only MOOC educated which I've gotten really big recently so online courses, educated person would be eligible for working in research and how does such a person cultivator research mindset something that they might miss? Oh,"
36:28,Pierre Stock,"yeah, so I think basically what it takes is just walking in passion and curiosity. So the people working in ml of a lot of chains because you have lots of resources out there. You have of course a babe belzer you can read them if you don't understand there's nothing wrong with it basically, because as a researcher, we don't understand anything. So everything at anything that everything you can check the medium posts or the YouTube videos, you have like a lots of resources to your that you can you can use them and leverage them what really adds me is to work with other people that work alone both as a student and also as a researcher By the way, but back when I was a student I remember always working with one particular person and we wish to do like we had the same interest was to do slightly different things and then we can learn from each other and then the bed vertices are not too good. So working group is very"
37:34,Pierre Stock,is a is very motivating and
37:38,Pierre Stock,fruitful.
37:40,Sanyam Bhutani,"We've also had this discussion on on the city so we were talking with attended was and Edward Harris was to co shop his mind they talked about being accountable when when doing group study also helps. So I think that also contributes to the motivation. Factor. Yeah,"
37:54,Pierre Stock,"yeah, of course."
37:56,Pierre Stock,"study groups and also reading groups are very, very nice. For example, at fair we meet every week with our intended PhDs. And we discuss things. So sometimes someone presents their work, sometimes. It's another paper, sometimes we just discuss, discuss ideas. I think it's so we should not we shouldn't neglect that. So it's not that we have one breakthrough session because it's not the case. Sometimes you feel you don't run anything, but I think it's, it's worth doing because sometimes we really add to another, another views of the beacon and get some new ideas."
38:38,Sanyam Bhutani,"Okay, I'd also give us okay, I'd also like to give a shout out to a community that I'm active in so DSNet dot org dsnet dot org you can join that for online research early paper, reading groups and study groups. We do that each week if the listeners are interested."
38:58,Pierre Stock,"Yes, it's one of the best ways To to keep up the fast pace of the field and to just to to learn things"
39:06,Sanyam Bhutani,like personally I find the online was slightly easy because like I can sit at home with convenience and also be accountable to other people
39:15,Pierre Stock,"yeah it's kind of another motivation when you go when you go to when you go go back to home and you go back home and like some people are expecting you to them Do you know her knocking endings? Oh, yes, right."
39:31,Pierre Stock,"Yes, very nice."
39:32,Sanyam Bhutani,So you just mentioned about the reading groups at FAIR Could you tell us like how do you keep up with the exploding growth in research who you're in when you mentioned you don't leave a lot of people's what other sources do you have for like keeping up to date?
39:45,Pierre Stock,"So yeah, should return must must read papers. But for the moment I rely most on my advisor because they have the kind of an overview as I can very quickly self doubt what they both are important and what papers on it Actually, I saw also to go out with my colleagues because they are from different backgrounds, different research areas, so it's very nice to keep up with new ideas. For example, when the Transformers came out, some of the students explained to me because I wasn't I wasn't able, I wasn't aware that gonna walk my walk machine vision and then the third goal is to have a good good paper manager tool. I would say I use it occasionally to preserve so by by capacity, which is pretty good. I think I should use it No. But once you have populated your every I think the details are quite, quite close to what your to your interests. So I'm on the bright side you have"
40:51,Pierre Stock,all the papersthat you care about in one place.
40:55,Pierre Stock,"On the downside, maybe you are trapped in a bubble when you only see your research. Research and not the one from the"
41:02,Pierre Stock,geocell.
41:04,Pierre Stock,"I would recommend also that people read articles that are not related to the Haiti to their smaller expertise are amazed that is also a smaller, of course."
41:16,Pierre Stock,So related to one's expertise and
41:19,Pierre Stock,because sometimes you like better ideas or better perspectives on on what you're working on.
41:24,Sanyam Bhutani,"That's a great insight. I think also for like people who aren't lucky to have advisors, Twitter serves as a great filter like if you follow your favorite researchers that all sites are a good filter for me."
41:36,Pierre Stock,"Yes, of course, because Twitter will adjust you reach up the most discussed they belong. Yeah, and I think in the lucky like me to have the most setup I think so. Yeah, definitely to James also, Peter is a good place to discuss quickly with people"
41:57,Sanyam Bhutani,concisely
41:59,Pierre Stock,Yeah. So you have
42:01,Pierre Stock,your via
42:04,Pierre Stock,"the nice thing is that everything is public. So yes, you can, you can discuss"
42:09,Pierre Stock,with anyone.
42:12,Sanyam Bhutani,So before we conclude Could you share any tips for beginners who are looking to get started in deep learning and also your best advice for future future facing researchers in the field?
42:24,Pierre Stock,"Yes, I think my my advice would be a kind of commando and I'm sure people are already determined but I think it's not it was the exact again now for those are 47 so the first one would be to not to be afraid to ask questions because if you ask yourself the questions there's a good chance that someone else so so I'll just asking the same question even keel for doublings muscle we can keep it nice at that good wrestler research. Actions often starts from very simple observations. And that people are used to neglect. So basically Tuesday's one of the main drivers of research. So you have to win, even to foster said to ask oratories as, as questions. The second thing would be, of course to ever ends on experienced runner to run every day. So of course, the reading groups are very nice for that. And also, you should start by implementing some things that you know works. So, like a simpler case, if I have any ministers if they're not with your family, family to library, and then the bishop and that's not the don't don't begin by implementing to our we can sing and images and move on talking. It's nice to take your message to talk. So the winner the key of research is just to be upon the ones that are expected. So just currently booze and ovens em and which is sometimes a bit, sometimes a bit and just to see what's going on. And also the third thing and which is a, which can can sound pretty boring, but actually it's true, at least from my perspective is is just to learn the basics of laner jaywalk status quo at then. I think even people often say that but I think really attitude First, the bugs are good. Because if you have a narrow view we can you better understand what's going on. You will give it to the burger more noisy. I know"
44:41,Sanyam Bhutani,"compared to like, getting stuck on that annoying little problem. Yeah."
44:44,Pierre Stock,"Yeah. Because you you will have an efficient of what's going on and also,"
44:49,Pierre Stock,it would
44:51,Pierre Stock,"equate to like, distinguishing that hormones decreases the statistics agency that basically so as a point where you want to agree to to Unemployment is so significant, for example, is to tell you to statistics and, and so just to get a feel of what it's like you should be here. Definitely study the basics"
45:14,Pierre Stock,and master the basics. Okay.
45:16,Sanyam Bhutani,I think that's that's great advice. Thank thanks for that before we end the call what would be the best platforms to follow you and follow your work?
45:26,Pierre Stock,I think is Twitter as everyone as never when I
45:31,Pierre Stock,"was a baby bells a good blog post on the Facebook blog. Okay, so its PierreStock on Twitter"
45:40,Sanyam Bhutani,"Not sure we will have it linked in. No. Okay. All right. Well, thanks. Thanks so much for joining me today and thank you so much for doing this interview. Thank you for you"
46:03,Sanyam Bhutani,"Thank you so much for listening to this episode. If you enjoyed the show, please be sure to give it a review or feel free to shoot me a message. You can find all of the social media links in the description. If you like the show, please subscribe and tune in each week, to ""Chai Time Data Science."""
