Time,Speaker,Text
0:13,Sanyam Bhutani,"Hey, this is Sanyam Bhutani and you're listening to ""Chai Time Data Science,"" a podcast for data science enthusiasts, where I interview practitioners and researchers and Kagglers about their journey, experience, and talk all things about data science.

Sanyam Bhutani  0:46  
Welcome to another episode in the data and data science show. In this episode I interview Pierre Stock. Currently a resident PhD student at FAIR: Facebook AI research lab Paris. Pierre has a background in math and machine learning with a master's degree in computer vision and ml. He's currently a resident PhD student at the Facebook a research lab and his interest for research include large scale learning, we will network compressions and a safety in general. In this interview will talk a lot about his research and deep learning research in general. The work and research process at Facebook AI research lab. We also discuss about his recent research blueprint titled quote, unquote, and the bit goes down revisiting the quantization of neural networks can find the link to the preprint in the description of the podcast. If you enjoy these interviews, please feel free to subscribe to my newsletter. You can find the link in the description. I released two interviews each week on Thursdays and Sundays. For now here's the interview with Pierre. Please enjoy the show.

Sanyam Bhutani  2:12  
Hello, Pierre, thank you so much for taking the time to do this."
2:16,Pierre Stock,Thanks. My pleasure to be here. Thanks for having me.
2:18,Sanyam Bhutani,"So, you currently a resident PhD student at FAIR, which is Facebook, AI Research for the listeners, Paris, and you have a background in math and machine learning. So could you tell us how you got started in machine learning and what caught your interest in the field?"
2:35,Pierre Stock,"Yeah, so basically, I would say a very critical path to my master's degrees and it is a French class coupled to us and an English changing in school. So basically, I have a mathematical and an engineering background. And I think we're pretty good into ML as Machine Learning is a desire to have a bus big wrong with like a fast paced field and also challenging problem and a potential impact on the society? And I always remember when I was young I wanted to build things. Like with the mechanicas I don't know if you know the name is"
3:14,Pierre Stock,the mechanics.
3:16,Pierre Stock,"Exactly. So you're like, you're like metal stripes and years and you want to connect them together."
3:21,Sanyam Bhutani,I think it's a metal logo. Lego if I may call it that. So metal version of the Lego blocks of sorts.
3:27,Pierre Stock,"Yeah, it was not yet. It's gonna first I love contracts and games. And whenever we come back from vacations, I built whatever thing I think I saw, like a, like a region inventor. Well, that's a lot. So I think I do the same reason I build things and I get to play with them. So it's kind of nice."
3:45,Sanyam Bhutani,"Okay, and I'm also curious like, so you followed the quote unquote, traditional path, which is like a basketball followed by masters followed by immediate, a PhD degree. So what made you pick the research part to the industry?"
3:58,Pierre Stock,"Yeah, so would say it's fair you get to do both research as any academic club. But also you can work with production teams, for example, to scale up your porch or to incorporate their constraints into your research. So this number aspect is very exciting for me. Again, something very unique I would say on so just to say that research and industry aren't mutually exclusive, and modern and I think like research you are judged by the work you publish by ups and not say by your prayer education, so it's both positive and also very challenging."
4:40,Sanyam Bhutani,I think it's also because you're you're looking at FAIR. So sometimes like there boundaries must be blurred?
4:47,Pierre Stock,"realize can kind of blurred the, what I really like is that you're really allowed to choose. And depending on your interests and wether prediction teams have the same interest as you given point of time. You can work with them. And you can also work on like more long term. Long term research is totally up to you. Interesting."
5:07,Sanyam Bhutani,"So I'm also curious, could you tell us more about the FAIR lab at Paris? Most people think that the quote unquote, AI Scene is in the USA or the Canada area. Could you also give us an inside scoop on how are things in Paris and the European media for the AC?"
5:22,Pierre Stock,"Yeah, so it's true that the US isn't the one, one of the centers of the AI along with canada can add also. But I would say that first in Paris fair is one of the biggest labs on liberation was one of the biggest labs in fair. I would also say that the setup when your PhD at Paris is quite interesting and quite special. So you get to partner up with an academic club. Okay, and then you PhD with both fair and the academic club. I have one I have two supervisors actually three, but one"
5:59,Pierre Stock,me in academic world and two at FAIR
6:01,Sanyam Bhutani,"Okay, so both you have multiple advisors for your current with this collaboration"
6:07,Pierre Stock,"with with financial planning is very interesting and very key for both actually because you don't get to partner with the best researchers while they stay since they're in their academic clubs. So and AI ecosystem in Paris is kind of quickly densifying. So you have lots of startups being created. And also, almost every major companies recently opened some labs. So your google google brain, which people such a garnishment you have mine with me knows who's coming back to Paris, never. So you were always in hospice. So it's pretty exciting times when you're doing various Actually, I would say,"
6:44,Sanyam Bhutani,"interesting indeed. So I'm also curious, could you tell us more about what does la a day in your life look like? So how does it day in the life of a PhD student at fear look like?"
6:55,Pierre Stock,"So basically, the I usually wake up in the morning and Check my logs. So basically check out the experiments I went in the nights went on."
7:05,Sanyam Bhutani,So you get the models running overnight and check output in morning
7:09,Pierre Stock,does that because otherwise I just keep looking at my logs all day long. Yeah. I think so. Come on fellas in the researchers were just
7:19,Sanyam Bhutani,"very interesting about watching the loss goes go down and stuff like that. So for sure, yeah."
7:25,Pierre Stock,"And if you are waiting for the next book to get better and not doing anything, I think one of one thing which is very was very productive for me is to run the experiments at night. And then has to find that the morning and then a lunch or the experiments depending on the outcome, and then what I want to I want to do I spend most of my day like dinner. Sometimes doing also a theoretical walk was like a paper open equations. I would say I don't read as many papers as I should do. So I have to walk on, but it's crucial to keep on the to be the fast pace of the field. But I have to admit I don't do that. Enough. And also I discuss with my colleagues that we take benefits. So it's a nice look nice, nice break. But also you can talk about research by paying by lunch. And also, as we tell, but I think everyone does. That's"
8:30,Sanyam Bhutani,"a common question that I want to ask you that is also common in the community is that how's the How does the research pipeline work? So how do you approach a new problem? And what are you going to stay when, for example, you think you've often experiment and what questions do you ask while when you about to start on a problem?"
8:50,Pierre Stock,"So it's a very key How do you do research? Very last questions, I would say by messaging to things that may or may not fella told me, which are very, very interesting. I think the first thing you have to be curious about the program you're considering because curiosity will be one of the main drivers for your discoveries essentially, you're not curious about what the program is not worth investigating. It is for you. It's a gun you have to really like the projects you are working on. So it should be of yours. But if you don't like the project you're working on way less chance of being successful because you won't put in as much effort as you I like passion for basic projects."
9:32,Sanyam Bhutani,And one machine learning nothing works until it does. So you have to have the patience of
9:39,Pierre Stock,"once those two conditions are basically met. So once you are kind of obsessed with some problem, then you can start the basic year, which is the research itself and I think the most important thing is to be able to prototype very quickly. I personally use by Dutch so and incorporate here but I think it's also Really you should these are a library you are the most used to uncomfort comfortable with. And also write code as key and modular as possible. And it's not always the case. But I think you progress when the projects like when you accumulate many projects I wanted my first project was terrible in terms of maintaining code. So you refine your mistakes physically as everyone and the second thing would be to prioritize or prioritize, I don't know the exact English term but basically, you got to balance what time and effort it will take you to implement and say some feature you want to test and the potential a bed and they stated impact you without look. And the third thing is to follow your gut feeling. I I often I mean, you other when, since you work like a 20 year like a lot of time in your project, you have a feeling of what's going to work or not and sometimes Fear is wrong, you have to learn to listen to music in maybe you will find something interesting on you, oh, at least maybe you have some things at work, or that does, which which doesn't. But I think following your gut feeling is, is a very nice thing you have to rely on, especially when your students are because you have a feel of what's going to walk on it. And you should mix that guessing with the advice from your advisor. And very often, it's the choices even musically"
11:30,Sanyam Bhutani,"recorded. Also, you mentioned about being passionate about a problem. So there's this thing about being completely obsessed and knowing when to put a stop. So how to keep a check on if maybe the experiment would totally fail or if you may be wrong about how you're approaching it."
11:48,Pierre Stock,"Yeah, so I think that's one of the most crucial questions when doing research is experimental research like machine learning. And it's very crucial and thanks for asking this because if you Sir, very important. So the first thing I learned when doing my PhD was to distinguish signal from noise. And I like kind of a lot of time to do that. But basically, when you click, when you click quickly a broad idea, you want to change something, and you want to get a signal telling me a good improvement is and at the beginning of macchia, yellow quite of time thinking that something I modified it was actually you're bringing improvements, but actually was just within the standard deviation of the main of the main metric I was measuring. Okay. And so basically, when people talk to you that to perform operations to these and to about results with standard and NC so the mean and the variation like the SGD, it's not for yourselves. It's not to bother you, but it's essentially for you. To be able to enjoy your research is a is a either either going into the right direction on it"
13:00,Sanyam Bhutani,The idea in a movie?
13:02,Pierre Stock,"Yeah, so you should definitely check the work done [??] . You familiar with it, but some guidelines to how to publish an article but I think most of us some guidelines for you to do research and to, to distinguish signal from noise is that the filtering and I think it took me like months to really know. But otherwise you can get the hope to do that good researcher. Second thing is to discuss a lot with your colleagues or your lecture supervisors. Because the next day up into you and maybe less emotionally, emotionally involved, but are you ready because everyone secretly wants the excitement to succeed them? Of course. So it's kind of biased about the success but you sometimes don't see the contest sign of the don't sign of your approach. So stick with external colleagues, could be very beneficial."
13:59,Sanyam Bhutani,How's the environment at FAIR Paris has it all in house residents? Or is it also postdoc researchers?
14:04,Pierre Stock,"Yo. So in the lab, we have a bunch of PhD students, bunch of bunch of researchers and postdocs. So exactly, just reach out and say, Okay. And yeah, the first thing also about failure is to just to accept that some experiments will fail. Because sometimes you don't feel as good basically, because that's Korea, basically used to"
14:29,Pierre Stock,getting asked problems as a solution.
14:33,Pierre Stock,And we're not solution.
14:36,Pierre Stock,"So he's not to be a muzzle talker. And we'd have to accept, but it's a sense of research. And I would say, out of 10 ideas, if you have one that works and that hasn't been tried by someone else, you're pretty happy. So okay. But it took me like a long time to work on that."
14:55,Sanyam Bhutani,I think it's all about learning how to learn and learning how to research is also that comes into picture.
15:02,Pierre Stock,"Yeah, it's running but in a way that that can be different from school. So the the other touching time contributor a bit longer"
15:08,Sanyam Bhutani,"got it also to talk about your research interests, which are large scale learning and you relate compressions. So we're to lose some light on why these are important. And do you believe like these are also relevant to lay corporations outside of Facebook? Because Facebook like has a lot of data maybe like this could be important to other areas as well."
15:29,Pierre Stock,"Oh, yeah, yes, I do think so. So, first of all, I think those two aspects are closely related. So on the one hand you wish to leverage, like all the data you have and all the computing power, you have to train like large big models. But on the other hand, you want to make them available to everyone for cheap and cheap meaning low memory and also real time inference time for a quick inference time so if you want basically to improve your unit, your Yours is Beyonce, your attorney mooska, your drone, your, your whatever, you within such a good mother that you will need such a good mother, which is as smart as possible, of course. And with the rise of like a monkey, the natural reality, the use of smartphones on drones. compressing during the talks is kind of retails for everyone in the industry that does the juices and talks. And sometimes people don't realize maybe that when you compress in your the talk that you managed to embed in the smartphone, for example, yeah, you can perform inference on device. So it means that you don't need internet. Right? It means also that today, your data is the next day and this one's not one."
16:45,Sanyam Bhutani,It's also I think one of your other interests is also a safety so it also takes care of the privacy issues.
16:53,Pierre Stock,"So because the company has to expose itself by getting the mother encrypted in the photo under the On Boston data stays on the phone system. So it's I mean, it's crucial for the whole industry. Got it."
17:07,Sanyam Bhutani,"Also, since you're already talking about large scale learning, I'd also like to talk about your recent publication title, quote, unquote, and the bit goes down revisiting the quantization of knowledge. For the listeners, this will be linked in the description of the podcast if you want to check it out. So could you tell us more about the idea behind this research?"
17:28,Pierre Stock,"Yeah, so first of all, the title is due to one of my advisors. So thanks to him. And yeah, he's very simple. Basically, you want to leverage a vector quantization technique, and then we'll explain later what it really is But baby, but basically, you want to leverage weight discretization technique that is data dependent. So you want to contain a particular layer by hooking your outputs of the layers and then the weight themselves and look You eventually calibrate the output of the network."
18:03,Sanyam Bhutani,"to get caught it now also grew it was if you could tell us about what is quantization in in terms of neural nets and where does it come in the picture for for this research? Yes. So, basically a"
18:16,Pierre Stock,"quantization is essentially doing k-Means on the scalar or vector level [okay]. So, for those who are not familiar with K-Means, So, basically you have a collection of vectors and you wish to contain them and you will regroup to get the vectors that does the process and assign them to the exact same value so, basically again storage because you only have one century the set of closed vectors and and then just one integer per vector gets assigned"
18:50,Sanyam Bhutani,"another compression rates are also very amazing as, as you mentioned in the preprint. Could you also tell us about your intuition behind? Why does the compression bow"
19:01,Pierre Stock,"Yeah, so it's basically one of the first discoveries, we know networks done by local, which is called optimal brain damage. So it's a paper dating back from the 80s I think on 1980s and he demonstrates that you can remove a lot of connections in the networker, why do it canings the remaining ones and still being close to the original Colossians and"
19:28,Pierre Stock,it has also been demonstrated 
19:31,Pierre Stock,"by Denny later in the PayPal credit in time, it doesn't keep learning. So basically, you keep just when when small subset of parameters and you go to clinic, Joseph Joseph Smith, so it does come down to the redundancy of the parameters in the network. So of course, you can basically remove the other way meeting easier information you are talking."
19:54,Sanyam Bhutani,"I was I was also lucky to have Tim that was on the CD. So he's been working on sparse learning, but also he She has this thought that if we could, we can easily like get rid of a few weeks without affecting the accuracy of negatively."
20:08,Pierre Stock,"Yeah, exactly. Yeah. resources and cleaning things so removing the connections is exactly equivalent to having a spouse white matricies say removing on in connection it just puts you on it so that nothing flows through itself. Okay. It's like he's passing responsibilities isn't"
20:26,Sanyam Bhutani,caught it could you maybe tell us what led you to ask the questions? I just thought about that as the questions for this scenario. I think it's also mildly related to your earlier people that that's from ICL are 2019 title. Equal normalization of neural nets will have it linked in the description of the podcast
20:47,Pierre Stock,"yet, so music is one of the main main main link of render went way off my my PhD is a study of the atomic condition of neural networks. Okay, and you can legit in many ways You can use it to improve your communication procedures. And the one is welcome, sweetie, this is what you do and do it on paper. You can also use it, leverage it to contest to compress it into Excel. So basically, the ID came from one of my one of my beauty advisors, of course. But yeah, it's kind of linked to the previous one. So"
21:27,Pierre Stock,"basically,"
21:29,Pierre Stock,"there is a some redundancy, why don't we come? Don't you really contains between the dependent way on the mentor?"
21:37,Sanyam Bhutani,"Okay. Also going back to the question. So, like, how does, how does this research pipeline usually work? Maybe you bind when you're discussing with your advisor, you ping back and forth a bunch of ideas. And when it sounds interesting to both based on your intuition, then maybe you prototype so yeah."
21:58,Pierre Stock,"For example, for this project, I spent Like a two months talking like every day to one of my advisors to receive like three advisors one is always available of pretty so I go I go to the available one and ask the questions and those are different expertise or depending on the problem I have I know which one to contact first but yeah the idea to speak like every day to and to give I mean I don't try to wait for the better or the perfect setup with the perfect condition experimental conditions I just the food the reasons as Emma and me and then we discuss on his legs an offender In addition, we had some some good ideas to"
22:46,Pierre Stock,when you are blocked and when when we didn't know what to do.
22:49,Sanyam Bhutani,"Okay, also. So if you could tell us more during these two months, where you also like constantly prototyping as you discussed and like then discussing the results with the advisor or how was that"
23:00,Pierre Stock,"Yeah, what's good in every day or every night depending? I was, so we have the advantage of prototyping Oh, so is that you get results in like one or two or Well, yeah, we're working with a file, then in a small commit. And then you can get a feeling of it, which is walking. And once this phase is over, then you go to the real world setting. So meaning you mentioned it and you'll have net for example, and then you will get all the bypass Ibom it does you check that your intuition on the smaller levels are right. And then also going back and forth. But then when 26 like one or two days, we have to be a bit more organized, I would say."
23:45,Sanyam Bhutani,"So I'm also curious you in the people you mentioned that the results and speedups are indeed very exciting. They are double digits, not just percentage, but double digit for residents. So do you think these techniques can also be External to outside of resonates to other continents."
24:04,Pierre Stock,"Yeah, of course actually we extended it to Mask RCNN in the deterioration of the paper so is the mother is also available on nine because Mask RCNN will be a fit for every year everyone working with vision you do so I managed to edge to get Mask RCNN sand into like roughly 6 Meg bytes versus 170 megabytes. But then I should say there are multiple approaches to compressing your network. So I was doing quantization vector contamination or other people are just trying to design new architectures on so think of mobile net efficient net also efficient. Yeah. And some people are also doing a premium select users. I think that to be users connections are. Some people also are doing like hardware dependent quantization. So you have some specific hardware on a chip that Vivian in like a horn or someone"
25:00,Sanyam Bhutani,for TPUs too?
25:03,Pierre Stock,"end user, but for smartphones also, maybe you want to adapt the compression rate to the hardware you have while maintaining your constantly inferenence time. So it's nice work by by some guy at MIT. So it's not just to give you an overview of the field and that maybe they combining some of the methods you get you get some it's the best, the best compression ratio."
25:30,Sanyam Bhutani,Okay. So you've also provided an open source implementation titled Kill the bits. So first question is what really the name or isn't it from and if you could also tell us a bit more about the code base.
25:45,Pierre Stock,"Yeah, so basically,"
25:48,Pierre Stock,"basically the name is also for my supervisor. So the same that that founded And the bit goes down. Basically, the idea is to provide both the goods for producing results in the paper. So the whole pipeline for quantizing. But also for people that don't have the resources of the time all the time, just provide the compressed models. And you can already perform inheritance. And so those are the two aspects. And we have two branches, one branch father resonates and the other one for the most kassian. Okay, okay. But we're going to be Caesar is welcome. So God is not perfect. But at least it's it sounds, so it allows people to prototyper like more noisy."
26:34,Sanyam Bhutani,"Could you maybe tell us like how much refactoring Do you usually do when releasing in a public open source version? So like doing research, you of course, want to be like prototyping really fast. So how much refactoring does it take"
26:45,Pierre Stock,"afterwards? So basically, on the ICLR project, so the thing I did a lot of refactor because I didn't develop my god like as keen as I would monitor. So basically, it was a missile. So you had to be like some days to effect on on this project I basically did nothing because I I forced myself to have like a reasonably clean code that could be open source that every time so it saves me a lot of time actually agenda not only for the king but but also for the research in part because if you're a kind of a Kenyan mangaka you can prototype noisy"
27:28,Sanyam Bhutani,"in the noise you may forget who wrote this code and what was enough me had written this code I mean, life happens for me."
27:35,Pierre Stock,Yeah. Everyone does so.
27:41,Pierre Stock,"science and sometimes the only thing refraining you from testing it is just I don't want to minimize it going to those three files are you get to reduce damage I want to get it to all the functions to the down to the function a monster. So one of the main brokers I tried is when you have like you're good, that is not good you as you as you as you Much would test less ideas, which is also very bad. So, um, I think you will get, you will get get the advantage of being in the making code."
