Time,Speaker,Text
32:17,Dr. Olivier Grellier,"I think the only one I managed to resist was Peurto siguere. And even on this one it was, it was quite difficult to manage to get to stay glued on the Private Leaderboard. I think that the first thing is really trust your CV. And, and publicly Leader Board is just informative. And the second thing is really understanding that how private and publicly Leaderboard has been split. So for IID competitions, usually simple. It's just formed on so for idea I would go for serially and time series. It's really unique to split over time and make sure that throughout all of our features in that if you don't, then you'll on Private Leaderboard."
33:18,Sanyam Bhutani,Yeah. 
33:20,Dr. Olivier Grellier,"Yeah, but I still have to work on that actually. "
33:24,Sanyam Bhutani,"Got it. So coming to another question that I am sure most of the Kaggle community, most of the time faces is, how do you come up with new ideas when you're working on the competition? How do you continue improving your score, after you run out of ideas, for example."
33:44,Dr. Olivier Grellier,"Yes, so as I yeah, and you in fact it all, it trains your brain? So you can think of feature engineering without noticing in fact, it's just gets a habit. So for these type of competitions, you will do one thing and follow the different, different things. So what I usually do is I don't look at the big columns first."
34:14,Sanyam Bhutani,Okay. 
34:15,Dr. Olivier Grellier,"And then when I get out of ideas, I would look at public kernels and discussions and try, and trying to find out what really, what I could write or code or what really makes sense to me. The other thing is to understand even deeper the problem and the features you have available. And then usually you can, just thinking in practical terms that you can say, you can think of many different new features you can, you can create then, then you can go with different models and usually having Linear models, tree models and neural nets. You need to think differently about the data set and react processing differently. So that brings new ideas then, then really if you don't have any ideas anymore, team up. "
35:19,Sanyam Bhutani,Okay.
35:20,Dr. Olivier Grellier,"Yeah, that's, then that's the best because you can really speak to someone, share insights, and share findings. And then you can think of new things you can do. Yeah, that's probably best."
35:36,Sanyam Bhutani,"Got it. So, my this, this has been a great interview. My final question to you before we conclude is what best advice do you have for someone who's just starting out with machine learning?"
35:50,Dr. Olivier Grellier,Do Kaggle. Hehe.
35:51,Sanyam Bhutani,Hehehe.
35:53,Dr. Olivier Grellier,"Go on Kaggle, read books, get, get online courses. Then practice, practice a lot. "
36:03,Sanyam Bhutani,Practice on Kaggle.
36:05,Dr. Olivier Grellier,"Yeah, practice on Kaggle and all order competition. Competition sites. But yeah, you need to add this practical, your training to really benchmark all the things you learned. Yeah."
36:22,Sanyam Bhutani,"Got it. So thanks again for this interview, before we end the call what would be the best platforms to follow your work?"
36:32,Dr. Olivier Grellier,H2O.ai!
36:34,Sanyam Bhutani,Okay. Hehe. Any social media links that you want to mention?
36:40,Dr. Olivier Grellier,"Yeah, I think that I don't publish any work anywhere except on for H2O the website I'm using the most is medium, really. "
36:53,Sanyam Bhutani,Okay.
36:53,Dr. Olivier Grellier,It's a really good one.
36:56,Sanyam Bhutani,"We will have that link. And if anyone visits the H2O conferences, I think that will be the best place to get a hold of you. "
37:04,Dr. Olivier Grellier,Hehehehehe. Yeah. 
37:06,Sanyam Bhutani,"Okay. Thanks. Thanks so much again, Olivier for doing this interview and for all of your contributions to the Kaggle community. "
37:13,Dr. Olivier Grellier,"Thanks a lot for your nice, well, it was, it was really good talking to you. Thanks Sanyam."
37:19,Sanyam Bhutani,Thanks again.
37:25,Sanyam Bhutani,"Thank you so much for listening to this episode. If you enjoyed the show, please be sure to give it a review or feel free to shoot me a message. You can find all of the social media links in the description. If you like the show, please subscribe and tune in each week to ""Chai Time Data Science""."
