Time,Speaker,Text
25:11,Shivam Bansal,"Right. So these competitions, as I mentioned, requires a very comprehensive solution. So it is always good to start with a very simple solution or a very, start with very basic solution, let's say, as I mentioned this competition at four to five different streams. So a good strategy is to pick one of the team and try to come up with a simple approach or a simple solution for that, let's say you want to measure if job bulletins has racial bias or gender bias. So just come up with one visualization and see if that visualization is explaining the racial bias or gender bias in them. And then over the time, over the next few days, I creatively add more visualizations. I creatively add more statistical analysis, more recommendations and improve on top of that. So I believe these competitions also follow somewhat similar pattern to traditional Kaggle competition where you start with a baseline, and then it will improve. And then in the end ensemble different techniques to come up with stacking type architectures. So similarly, in these competitions, we also have to do the same thing, but it's not just we have to do for machine learning, maybe for analysis, maybe for some other types of EDA, maybe for visualizations, etc."
26:28,Sanyam Bhutani,"I think that's also great advice that what many people think of is the biggest model that, they can just throw at the data instead, you also have to work on small models, didn't create a POC or MVP in terms of the business will then complicate it for them."
26:43,Shivam Bansal,"Yeah, and that that's, that is very similar to what I've seen in all my past industrial projects, any business problem, it always starts with the simple solutions, the customers or the clients, they are not looking for very high accurate models in the first place. They're looking for an end to piece which shows that data science solution can give them something. "
27:04,Sanyam Bhutani,"And they are actually aiming for that final big, huge, yeah, that can do whatever but they do start with the small."
27:13,Shivam Bansal,"Yes, because they want to convince them first that yes, data science can do something, because they always have the business problem, but when we show them to see, so then they are aware that yes, we are on the right track. Now let us spend our time and effort and money to make the solution more comprehensive and more accurate."
27:31,Sanyam Bhutani,"Got it. Also, thank you for sharing your wonderful solution viral blog. I'll have that link in our podcast description. Also, could you tell us a bit about your solution to the to the data science for good challenge."
27:46,Shivam Bansal,"Sure. So like I mentioned before, I structured my solution in six different steps. And that's how I always start my any solution like I always break the bigger problem into different companies. And then come up with different kernels or different strategies or different solutions for every sub task that I have broken. So as I mentioned, first step was just to gain all the business ideas. The next step what I did was I created a very strong natural language processing engine, which, which was used to convert all the unstructured data into structured format. So I started small, I started with simple regular expression, keyword based layout based approach. But over the weeks, I kept on adding more grammar based rule, part of speech tag rules, more natural language processing techniques, and over the week, the solution evolved and solution improved in itself, but the biggest takeaway, which I learned from that first part was that I focused on completing that NLP engine end to end. Like at the first go it was giving very bad results, but it had all the components. It was giving all the variables that were required to be extra. And that's what I focused in the next few weeks, in improving the accuracy. So that was like the first part. The other part was more about quantification of those unconscious bias present in those job bulletins or job descriptions, etc. So that's where I made all the business knowledge which I gained from the internet, that came into picture, I converted those business insights which I learned, into data science strategies into different types of EDAs, which can be done, differently statistical analysis, which can be done. So I kept on it, relatively trying and implemented those techniques on the real data sets, which were available. I got to know that about five out of 20 ideas worked, which is very true in in all the data science scenarios that whatever, you know, not everything can work. So that's where I picked all those ideas which worked for me, I then polished upon those ideas. One of the important piece was validation as well. We can not just start with our hypotheses and say this is coming from the data. And this is true. So in this case, since we did not had any unseen data or any external data on which we can see whether our approach is good or bad. So that's where I use the concept of simulation, I designed the experiments in which assimilated world or simulated population was defined. Every population had some application, some candidates with different attributes. And then I take that whether the insights coming from my analysis or insights, are they creating some impacts or some fluctuations in that simulated environment? And are they significant enough to say that this insight or this recommendation is relevant? So I incorporated this, yeah."
30:46,Sanyam Bhutani,This was really your validation strategy to create a simulation of it.
30:50,Shivam Bansal,"Yes, yes, because I made sure that simulation is very similar or it mimics the real world. What I tried that I used census data, I use CT demographics data and all the aggregated values to generate those simulations. So in essence, the simulated data was not fake data or dummy data, this was very close to the real data set, as they call it, that is also one of the takeaway, which I would like to highlight here that sometimes simulations can also be very helpful in validating your approaches. Well, the third part of this, my submission was deep analysis of textual data by the means of content analysis, language analysis, word choice, text complexity, etc. So that's, in that piece, in that kernel I focused a lot on NLP techniques. I, quantification of men of all the different sentiments or different insights present in the data, and also measuring how well the person has written the text, is the text actually serving the purpose? For instance, there is an important section in job description which is called duties. What are the duties to be performed? So, by the use of natural language processing, can we collectively measure, is the duties fulfilling the purpose? Is the duty section explaining what are the actual duties to be performed? So, by the analysis of what kind of words the person has used, what kind of town phrases are present, what kind of word choice they have used, are they actually serving the purpose. So, these are I would say all the business ideas, and you, by using techniques like NLP POS tagging and you with the use of Python, I converted them into implemented form and then using visualization I made sure that the right idea which I want to convey is actually conveyed. And, so, this was the third part and finally, in the last two parts I made use of, for the natural language processing technique. Like I used fast text model to generate word embeddings for every sentence and then identified if there are contextual similarities between. Then in the job requirements, and whether I use those contextual similarity as a way to link those promotional pathways, let's say if an employee is working on one position, but after serving a complete, decent amount of experience, they can be promoted to other senior most role. So those things I captured using text analysis, and then I use d3 dot JS to visualize those permission pathways as well. So this was my whole solution. I believe that, that is very comprehensive and very long, may not be expressed in this podcast, but definitely I think anyone wants to refer they can definitely, refer my blogs."
33:40,Sanyam Bhutani,"We have all of those links also for those who want. Yeah, thanks. Thanks for the comprehensive summary also. So my biggest takeaway from this is A) you don't have to have the business knowledge when approaching a new problem. So people, like someone might think of this as we need to teach a hiring person machine learning to to be able to solve this problem. "
34:00,Shivam Bansal,Right. 
34:01,Sanyam Bhutani,"And the second takeaway for me is spend a lot of time on understanding the data. And even then, continuously, like you said, you were validating your ideas constantly, while even adding every future you will constantly visualizing"
34:14,Shivam Bansal,Correct.
34:15,Sanyam Bhutani,"Got it. And the other thing I wanted to ask you, like you mentioned, one out of 25 ideas work, it's probably worse even for most, some of the problems. So how do we know when to stop approaching with with this angle or stop trying this idea that wasn't working or might not work?"
34:34,Shivam Bansal,"Right. So I think the walk around can be taught from the other way, like in the first go, what we can do is start or create a list of very comprehensive ideas, different, all possible ideas, what can be tried, then, like try those ideas one by one and just make sure to log everything just make sure to document everything. What actually worked in that idea, whether this feature came up to be important whether this feature had some different impact; maybe you tried a machine learning idea, say you assemble models together and see something worked or not. So also creating that documentation say in a simple Excel file can also help you to gain and get an overall idea about what things actually worked and if there is scope to expand mode, is there is scope to try some more ideas, more status, some general pattern, that in general, most of the ideas are not working. There are specific type of ideas which are working. So probably we are on a saturation level, we cannot apply more. So I believe that that, creating that Excel file or documenting your ideas, and it's really all the ideas,"
35:42,Sanyam Bhutani,Treating it as a science problem. So having this lab journal of sort.
35:47,Shivam Bansal,"Yes, yes.."
35:48,Sanyam Bhutani,"Got it. So I also like, there's this common misconception that you can't be good on Kaggle unless you have a mega ton of servers or at least early Junko graphic card. So what are your thoughts on that about the hardware setup required to be to get a good taste of Kaggle?"
36:07,Shivam Bansal,"I believe that's one of the very biggest misconception people have. Because even with very simple specification, and very simple hardware, people can actually create very good, insightful analysis and machine learning modeling stuff. So I don't think people should just think about hardware specification, whatever they have, whatever resources they have, they should just take the first step, start with small things. And nowadays we have free Kaggle kernels, which have very good GPUs and even Google collab. So which provides the services for free. So if the requirement demands very good hardware, we can jump to these use cases. But all the other use cases or a majority of the use cases, can actually be solved with minimal hardware requirements. "
36:55,Sanyam Bhutani,"Got it. Also, you've been very vocal about the sort of toxic practices that have been cultivating on Kaggle. So how does a beginner avoid falling into the traps of the one, who's not very experienced or doesn't know what's going on?"
37:11,Shivam Bansal,"Right. So I believe people should be aware about or should, should know about what Kaggle actually is. Kaggle is not a platform to say, make your social media profiles. Kaggle is a platform to make your work profile. Kaggle is a platform to practice skills, learn from other skills, which is the most important skill. When someone understands these points, what Kaggle is actually meant to be, then they should know that it is important to appreciate other people's work. It is important to respect other people's work and toxic practices like say plagiarism, or be it, abusive language or something; those things are not on, valid on Kaggle platform because somehow, they can create some maybe good kernels. But if they have a bad reputation in the Kaggle community, and Kaggle is a worldwide known social, so that somehow will reflect on that person as well. So I, my biggest advice is to treat Kaggle as a learning platform and don't just think, to use Kaggle in some other forms."
38:12,Sanyam Bhutani,"I think also, as like people call it to be a second time job, really treated as a job environment."
38:18,Shivam Bansal,Absolutely. People spend like hours and days and weeks on day. So it's not just about you can start toxic practices and maybe disrespecting other people's work. You can learn if you appreciate other people's work.
38:33,Sanyam Bhutani,"Got it. So this also brings me to a question that even I sort of continuously ask myself is that, for example, I look at your guns, I get to learn a lot. But what if I want to build on top of it? So there is this fine green line that approaches if like, I might be plagiarizing your work if I'm trying to build on top of it or build something similar to it. So how does one take care of that?"
38:54,Shivam Bansal,"Yeah, I think whenever, there are always these cases, I think what people should try is to take inspiration and take ideas from other people's work and not try to just exactly replicate and reduce it as their own kernel, they can replicate for learning purposes. But take inspiration about, see I use some fancy visualization, I did some cool Ed there, you can try to replicate the same thing, but maybe on a different data set. Or other way can be you come up with an improvement, you come up with an enhancement, what people can do is that they can keep the entire kernel as it is, but in the end, they can share that these are the 10 new advancements on top of say Shivam's kernel. Appreciating and writing, giving credit to the original author are definitely some of the good ways to keep continuing in that work, and as well as the Kaggle community."
39:47,Sanyam Bhutani,"I think one of the traps that beginners fall into is they're trying to chase a kernel because of the gamification But what they don't realize is Kaggle is this beautiful community of people sharing their resources, so you might get away with a medao or two, but when you get back to the community for their help, they might not be as respectful of your approach."
40:06,Shivam Bansal,"Yeah, and not just community, but also in their real life jobs because somehow people know each other. And somehow, all these practices can be like, everyone can be aware about who did what, you know, it can reflect on your work as well."
40:21,Sanyam Bhutani,"I think again, it's like if you treat it as a job, and you're essentially stealing your co employee's work, that would have an effect down the line. "
40:29,Shivam Bansal,For sure. 
40:30,Sanyam Bhutani,"Yes. Got it. So setting aside these toxic practices assumingly, like one takes care of this. Do you think a non traditional, quote unquote, background person can like get into, get to break into data science fields, just on their Kaggle experience, based on that."
40:45,Shivam Bansal,"I believe yes, because first of all, Kaggle is a kind of a platform which can guide the person into right direction in terms of what all skills are required, what are techniques to learn. And secondly, Kaggle is a very well known platform all across the world, all across the data science community. So if a person is having a good Kaggle profile, so it can help the person in getting the data science jobs as well."
41:09,Sanyam Bhutani,"Got it. And what are your best tips for beginners who are just getting started and aiming to become Grand Masters, hopefully one day."
41:18,Shivam Bansal,"Right. So my one of the biggest tip is around learning. So whenever a new person wants to learn something, they sometimes refer to online courses, or maybe follow some blog articles, etc. And one of the pitfalls I have seen in many junior or aspiring data scientists is that they tend to get deviated from what they started. Maybe they find that this course that they started is becoming more complex, they are not able to understand this thing. Or maybe they got feedback from their fellow employee or their friend who said, don't take this course, wdon't you take other course. So my biggest advice is to stick to whatever you have started, stick, try to complete even if you feel that maybe you are not learning that much, maybe you're not getting that much but at least try to complete all those things that you have, at least started as such. The second advice that I will have is around end to end thinking, don't just treat data science as statistical approaches, machine learning approaches, modeling etc. Because all those things as you also mentioned that, that, that can be done in four lines of Python code. Data science is much more than that you think about why business need, why data science solution needs to be created and who will be impacted what are the roles and responsibilities of person that you are going to affect with your data science approach. And the third advice that I want to give is the structured thinking, most of the data science or analytics problems are open ended. They are, they are unstructured in nature. So if you have this mindset in which you can come up with a structure in the problem, you can come up with a ways to tackle down a problem in a step by step manner. You can approach the problem very well, you can implement that as well."
43:04,Sanyam Bhutani,"Got it. So what like I might do is like as, as a software engineer, we try to think of how cool, in what cool manner can we solve this, in this four lines of code. But it's really about looking at things in a business fashion. "
43:18,Shivam Bansal,Definitely!
43:19,Sanyam Bhutani,"Got it. And before we conclude, so any best tips for people who feel intimidated by the field, because like;"
43:29,Shivam Bansal,"Yeah, because people just should take the first step. It's all about taking the first step, just like, just maybe participate in very popular Titanic competition and get a taste of what can be done. What are the things out there and then make a plan, make a plan about how you want to learn, say machine learning or natural language processing? What do you want to do? Do you want to take a course? Do you want to write a kernel? Do you want to participate in a competition? Write a plan because we know that people are not good in following the plans, but at least when you write a plan you, you get a sense of the steps which are required. So just taking the first step, making a plan and just get your hands dirty with all the problems is the first step, which everyone should do. "
44:15,Sanyam Bhutani,"Awesome. Also, if you could tell us, how could we best follow your work? Kaggle is there of course, where else are you active? What platform?"
44:22,Shivam Bansal,"Yes, I am very active on LinkedIn, and Twitter as well. So maybe we can link."
44:29,Sanyam Bhutani,"We'll have all of those links in our cards, and the description. And what's next for you now that you're already a kernel Grand Master and you're also about to complete your masters?"
44:39,Shivam Bansal,"Yeah, so definitely from Kaggle I will try to improve my profile in terms of competitions, like I have not very focused fully or dedicatedly participated in any competition. Maybe I'll try to do that. In terms of my work experience, in terms of my next opportunities, I will be working full time in, let's see, I have a couple of options that I want to pursue in. So I'll be deciding on that. And at the same time, I want to keep a sense of research in me. I want to, parallaly I want to do different research ideas and see if maybe something new can come up."
45:20,Sanyam Bhutani,Got it. Alright thanks so much for all the great advices and for all the things you been doing for the community and all the amazing kernels.
45:28,Shivam Bansal,"Thank you so much. Thank you so much for inviting me as well. And it was also a great experience to talk about all my experiences that I gained, so hopefully the community may be benefited."
45:40,Sanyam Bhutani,Thanks a lot.
45:52,Sanyam Bhutani,"Thank you so much for listening to this episode. If you enjoyed the show, please be sure to give it a review or feel free to shoot me a message. You can find all of the social media links in the description. If you like the show, please subscribe and tune in each week to ""Chai Time Data Science""."
