Time,Speaker,Text
0:13,Sanyam Bhutani,"Hey, this is Sanyam Bhutani and you're listening to ""Chai Time Data Science"", a podcast for data science enthusiast where I interview practitioners, researchers, and Kagglers about their journey, experience, and talk all things about data science.

Sanyam Bhutani  0:46  
Hi, everyone. Welcome to another episode of the ""Chai Time Data Science"" show. In this episode, I interview Shivam Bansal, who is one of the top kernel Grand Masters on Kaggle currently ranked fourth in the kernel rankings. Shivam is currently working as a research scientist at NUS and he has been working in the data science field for the past few years. We talk about his journey into data science, his Kaggle experience and about his recent competitions solution to the competition that he's recently won. We also talk about his pipeline for writing the amazing kernels, and blogposts that I'm definitely a fan of. Without further ado, enjoy the show.

Sanyam Bhutani  1:44  
Hello, Grand Master, thank you so much for taking the time to do, to do this. It's really an honor for me to have you on the interview series."
1:51,Shivam Bansal,"Yeah, thank you so much Sanyam for inviting me. It's all also an honor for me to be part of this excellent ML series interview."
2:00,Sanyam Bhutani,"Thanks. Thanks for the kind words. Today you ranked as one of the top kernel Grand Masters, you're also a research scientist at NUS. And you had been working in the data science field for quite a while."
2:11,Sanyam Bhutani,"So, could you tell us what got you interested in data science at first?"
2:17,Shivam Bansal,"Yeah, so I did my undergraduate studies from computer science and engineering background, back in 2010 to 2014. So during the last few semesters of my course, I got acquainted with courses like natural language processing, computer vision, image processing, etc. That time I was not very much interested into these courses, but just out of curiosity, just to do something different from what other people have been doing I took these courses and later I got very deep interest in natural language processing specifically. And coincidentally, like my first job, my first company was also looking for people who had computer science background along with interest in natural language processing. So that I would say was that started my data science journey."
3:05,Sanyam Bhutani,"Got it. And I think this is like before you in TensorFlow was public, before there was this boom, so to speak. "
3:11,Shivam Bansal,"Absolutely, absolutely. That was the time when things like regular expression TFID of these techniques were very popular. These are the main go to techniques for any problem."
3:22,Sanyam Bhutani,"The state of the art, so to speak."
3:24,Shivam Bansal,Yes. 
3:26,Sanyam Bhutani,"Got it. And contrary to what people do, like they sign up for Kaggle after they want to get it. So data science, you had been working as a data scientist, and you signed up for Kaggle later on, so could you tell us what made you sign up for Kaggle?"
3:39,Shivam Bansal,"Yeah, so, so I was aware about Kaggle when I started data science, like back in 2014. So in fact, I was working on sentiment analysis problem. And at that time, one of the competition on sentiment analysis was also running on Kaggle. So just to get references just to get more ideas. I got aware of Kaggle but at that point of time, I did not join Kaggle, well the reason for that was I felt maybe I am not very much into competitions on machine learning, was not my core skill set at that point of time I was only into NLP. So I just took a hold that time. But after a couple of years, I would say in 2018 then I had this hobby of writing blogs, articles, etc, on different platforms. So whatever I used to learn whatever I used to whatever I learned new, I used to document it in the form of a blog or article."
4:36,Sanyam Bhutani,I am a total fan of your blog posts also by the way.
4:39,Shivam Bansal,"Haha, thank you so much. So, so I just just for fun just for side projects, I thought why don't I try something new, something, a different platform to share those knowledge which I have, so I started Kaggle kernels and I shared my first kernel in a competition which was donors choose competition and fortunately this kernel was also selected as winner of one of the kernel awards. So I realized that Kaggle kernels is not just a very good way to, to do apply data science, practical data science, but also they are a good way to, like write blogs in a different form in which you can get a direct feedback from the community. You can also get inspiration and motivated by seeing other people work and when people appreciate you in the form of say up voting, liking, commenting, so that that's kind of a great feedback that you get. So that's how I started Kaggle lately as such."
5:35,Sanyam Bhutani,"Got it, and I think you absolutely smashed it. You became a Grand Master, I think in less than under a year, in about 9-10 months."
5:44,Shivam Bansal,Correct. Yeah. So nine months to be exact. 
5:47,Sanyam Bhutani,Wow!
5:47,Shivam Bansal,Yeah. 
5:48,Sanyam Bhutani,"So can you tell us more about your Kaggle journey like what got you addicted to Kaggle when you finally like, caught the Kaggle bug."
5:56,Shivam Bansal,"Right. So as I mentioned, I always had this habit to do something to involve myself in something. Before Kaggle I was doing maybe similar stuff but in the form of say blogs, articles on or on some other mediums, like I used to write a lot of research paper as well. When I got to know Kaggle I just shifted all the focus on Kaggle and started sharing whatever knowledge I gained in past four or five years in the form of Kaggle kernels. Luckily, all of my work was appreciated a lot by community even even by Kaggle. I also want a couple of Kaggle kernel award, swag prizes, etc. So."
6:34,Sanyam Bhutani,I think in the first year itself.
6:36,Shivam Bansal,"Yes so that added on top of like motivation or motivating factor of keep writing kernels keep sharing what you what you know, as such."
6:46,Sanyam Bhutani,And do you think your previous experience or industrial experience was helpful as well? For the kernels.
6:52,Shivam Bansal,"Definitely, I believe whatever I learned, whatever I knew, the things which work, the things which are liked by business people, or how to approach unstructured problems. Those are some of the skill sets I gained during my work experience. And those are some of the things which I applied in my Kaggle kernels as well. So that experience definitely helped."
7:13,Sanyam Bhutani,"Got it. You're also currently working as a research scientist at NUS. So, could you tell us what problems are you looking at work? And is like Kaggle related to these problems, where does Kaggle come in the picture for you."
7:24,Shivam Bansal,"Yeah, so, I am working mainly in the areas of banking, finance and FinTech. As a research scientist, my goal is to try different ideas, try different experiments, from research, from analytics data science and try to solve the traditional banking methodologies."
7:43,Sanyam Bhutani,"The machine learning space, right? Just"
7:47,Shivam Bansal,"Yes, yes, I would say it's a mix of both research as well as applied, I have to come up with new ideas, new research ideas, and then also make sure to implement them to apply them on real data sets as such."
7:59,Sanyam Bhutani,Got it.
7:59,Shivam Bansal,"So for instance, I am looking for some of the alternative data sets and a fusion of concepts like network science and analytics to solve credit scoring in developing countries. So these are the conventional problems, traditional banking problems, but nowadays with more data, more techniques on how we can mix them together in order to improve what banks have already been doing. So these are some of the top level problems, I would say I'm working on. Talking about Kaggle, I would say Kaggle is not directly related to these experiences, to these projects, but whatever I'm learning from these projects is definitely something new, which I somehow apply in my kernels indirectly or directly. "
8:42,Sanyam Bhutani,"Okay, so both sort of reinforce each other in in a sense. "
8:46,Shivam Bansal,Absolutely. Yeah. 
8:47,Sanyam Bhutani,"Got it. And also, like, I think this is also a full time role for you. So how do you find the time to Kaggle because Kaggle in itself is also a full time role."
8:56,Shivam Bansal,"Correct yeah. Yeah so I treat Kaggle as my self learning time. So whenever I want to, let's say learn applied skills, I have learned a new research paper, some, some new concept from a research paper, but I want to apply it, I then go to Kaggle and write a kernel about it. So I treat it as something, a time in which I can learn something. Let's say, spending a dedicated two hours time every day is something which I make sure that I do, because that's how I not only give time to Kaggle, but I also learn something out of it."
9:32,Sanyam Bhutani,"Got it. I also want to ask you like, what are your go to steps when starting on a kernel? And how do you approach a new problem? I assume like as a data scientist, we have to ask ourselves questions also before looking into data. So what questions do you ask when looking at a new problem or a kernel or data?"
9:50,Shivam Bansal,"Yeah, so I believe this is a very good question, especially for beginners. How to approach an unseen or a completely new problem? So I believe that most of the data science problems, end to end data science problems are highly unstructured in nature, they just have one business metric, they have a business use case. And as a data scientist, the rule is to convert that unstructured problem into a structured one, and then take baby steps, then take step by step approach to write the proper solution for that. So I always make sure that I always think into it, I make sure that why I, why my solution will affect, say business person or business use case. And I make sure to break down a problem into smaller steps, smaller components, and then dedicatedly focus on each and every component. And then I creatively improving upon those tasks and those milestones, in terms of accuracy, in terms of improvements in terms of interpretations, explanations, etc."
10:49,Sanyam Bhutani,That's good advice. I think looking at the bigger picture while also like breaking the thing down into smaller goals.
10:55,Shivam Bansal,"So definitely, definitely good. Yeah. So for instance, machine learning problems are considered as straightforward problems, you have ML problem, you have to write feature engineering, pre processing, ML modeling etc. But when you think in the business direction as well, even the data scientists can improve on those areas as well. Maybe you can come up with very cool feature new features, which can definitely improve your machine learning scores. So I believe a mix of both technical thinking analytics as well as business thinking is something which, which one should keep in mind while starting any problem. "
11:32,Sanyam Bhutani,"Got it, and I think your rich experience will definitely count here. So how do you suggest that a beginner ask the right business questions who, also how do we cultivate that business thoughts like we, going by you?"
11:45,Shivam Bansal,"Like so I believe the most important and the most easy way to do that is to get yourself familiarized with the problem statement with the industry, with the, with the business use case. Let's say if it is a finance related problem. I don't think it takes more than, say one or two hours just to read about basics of finance and basics about the specific problem statement. Let's say someone wants to solve fraud detection in insurance, it is always good to read about why insurance is important and why fraud detection is really important in insurance. But just getting those initial business ideas can spark something new, can spark some new ideas and creativity. And then data scientists can jump into the exact problem formulation and then coming up with a solution. So I will definitely recommend to just do not directly start your data science problem. Always read more about the problem statement, specifically the business context and ask questions like who will be impacted? How much they will be impacted? And if a data science problem, if a human can solve with this problem, how much improvement can a data science model do in the similar problem? So asking these questions can give the right ideas to at least set up a groundwork for all that machine learning pipeline."
12:59,Sanyam Bhutani,"I think this is not just government to banking, all other sectors are coming from my mind. "
13:05,Shivam Bansal,Absolutely. 
13:06,Sanyam Bhutani,"So I'm also a huge fan of your EDA kernels. And could you tell why EDA is so important? First of all, Kaggle and for yourself also. And I see like you seem to work on multiple problems in your experience. Do you think this has also a help you ask the right, again, the right questions about different data sets?"
13:25,Shivam Bansal,"Absolutely. Yes, I would say EDA is as equal, equally important to getting the right business ideas before starting the problem, because in the first phase, we are getting to know more about the business problem. And the second phase, which is the EDA get us help to know more about the data that we have. The kind of tools or techniques that we can apply can be answered directly from getting the insights from the EDA. So doing a very comprehensive and a deeper EDA can set the groundwork for the next steps of any data science pipelines say, which features you want to curate, which models can work, which type of insights or interpretations can be given to business people, all of those initial direction can be obtained from a very comprehensive video. And also these days data science project, I would say the successful and complete data science projects are the ones which are not just good in say accuracies or evaluation metrics, but also the ones which serves the purpose which have a logical approach, and which, which gives the right answers to those right business questions. And for this part, EDA, is definitely one of the answer. Doing a right EDA right approach can give you those right business answers, I would say."
14:42,Sanyam Bhutani,"I think this is also a beginner sort of confused data science because they think of this as this model outfit and accuracy. Okay? Whereas like business people don't care about those 1 or 2%. They're more curious about why you're trying to solve it. Right. So I also want to talk about the second category of kernels that I think you write, which are the tutorial ones. So, I think those are also similar to your blog post. So why are these important to you? Like, what's your motivation for these?"
15:10,Shivam Bansal,"Yeah, so I treat them as some of my documentation for a new concept that I learned, or maybe something which I want to refer back in future. So as ways to make your notes and since we have Kaggle, so Kaggle kernels is a very good way to make your own notes in the form of Kaggle kernels, which not only will help us but also may help many other people. So I believe Kaggle kernel serves these dual purpose in which you are writing tutorial for yourself at the same time for the community as well."
15:42,Sanyam Bhutani,"Good, And like I'm also curious, like many people are not like for them, it's this competition. So why, why not keep the secret sauces to yourself all of these knowledge that you've learned and gained? So why, why share it with the community?"
15:57,Shivam Bansal,"So in my experience, I would say I have learned from other peoples work as well, or the so called secret sauces. So I don't believe in just keeping, share secret sauces to yourself. If I know something new, it's good to share with the community. Because in somehow in the future, it will also help you. Because let's say when you see people are using your approach, then it's also sets up a standard, it also raises the bar for yourself. So in the next competition, or maybe in the next panel, you have to improve on your previous approaches that somehow improves you as well."
16:32,Sanyam Bhutani,Got it. And I also want to share with the audience that you're a kernel Grand Master but you still compete in a very special category of competitions which are the data science for good competitions. So what's your motivation for competing in this special category?
16:48,Shivam Bansal,"Correct. So I really enjoy data science for competitive and good challenges. This is because these are very open ended competitions. The problem statement presented in these competitions are very different from conventional Kaggle competitions, in which the conventional competitions asked for ML friendly problem statement in which the goal is to come up with the best possible model with the best possible evaluation metric on the leaderboard. I like those competitions in data science for good challenges that they asked for a logical approach a structured approach and end to end approach of how you approach the entire problem. So it does not require only machine learning skills, but it requires a good understanding of how you what, what is your way of approaching? What is your structured thinking, how you come up with the right visualizations? Do you have storytelling skills? Can you do an analysis which can just quickly explains all the business metrics as well as the data metrics to the business person and at the same time, they also involves concepts like natural language processing, statistics, even machine learning, deep learning in some cases. So in an overview, I would say these competitions, demand for versatile data science skills. So these competitions provides an opportunity to practice the complete data science lifecycle. Just by giving one complete solution you can, you can come up with a solution to the problems which are more closer to real life data science problems. That's why I enjoy."
18:22,Sanyam Bhutani,"I think these also sort of solve the complaint that people have with Kaggle, which is like it's just a modeling platform. I think these competitions make up for that."
18:30,Shivam Bansal,"Definitely. Yeah, many calculators in the past have said that Kaggle competitions are not equal to real life data science competition, but since last year Kaggle has released these, I think six or seven data science for good challenges and all of them presented a very different business use case. And all of them were very close to real life problems that personally I have seen in the industry and many other people as well."
18:55,Sanyam Bhutani,"Okay. So I think, I think that's another advice for the beginners to, if you are not very happy with Kaggle, please go ahead and try those competitions out."
19:04,Shivam Bansal,Definitely.
19:06,Sanyam Bhutani,"Congratulations. Also on your third win in the data science for good competition. For a little section, I'd also like to talk about the recent when your approach to it. So could you tell us a bit about the recent competition? And what was the challenge here and why it caught your interest?"
19:22,Shivam Bansal,"Sure, sure. So thank you so much for that. So yeah, this, I believe, was my third data science for good challenge. So in this competition, the business problem was very unique. So this competition was sponsored by city of Los Angeles, and they were in a situation that in a matter of one year, about one third of their workforce of the employees, they were eligible to retire. So they were having a lot of open vacancies which they wanted to fill in the next couple of months. They wanted to come up with an effective recruitment strategy by the use of data, by the use of analytics and data science and by effective data, effective recruitment strategy, they meant that they do not want any unconscious bias or let's say less diversity, less qualified candidates etc, they wanted to make sure all the candidates which are applying or getting on board, they have diversity in say gender, in say Irish ethnicities, races, maybe age etc. So, they wanted to make sure to remove that human bias which is generally present in, in, in the recruitment strategies. Additionally, they wanted to make sure that the any employer, which is part of this organization, they are, they are easily aware about the promotional opportunities that they have in the organization, because this is a huge organization with more than 50,000 employees and more than 200 different job roles. So, if an employee is working in the company, so, let's say they have a decent experience, they satisfy all the criterias but are they are eligible for next promotional parts that was not something which was really clear. So, they wanted to use make use of the available data and come up with a framework in which those commercial parts can be given. And on top of that, they wanted a very robust, very intelligent and comprehensive natural language processing engine, which can convert their unstructured job descriptions data available in different PDF documents etc, into one structured form, so that they can make more informed decision more data driven decisions about the vacancies, about the job roles, about the salaries, etc. So, this so, this problem had these multiple themes which I just talked about. So, this, like fusion of like three or four different themes in just one competition made, made this competition very challenging in my opinion. For instance, this, this competition required a solution which is complete in all sense, not just good technic, technical solution, but also solution which explains all these teams, all these components very well. And city of Los Angeles can just directly use one single solution to solve all their purposes. So that's why I decided I should try this competition."
22:17,Sanyam Bhutani,"So in a sense from what I can understand is, this was really like a data scientist problem rather than just a competition problem which is common to most competitions."
22:26,Shivam Bansal,"Correct. So maybe machine learning component was relatively lesser in this part. But we were open to use any approach as a, as the submissions given by different categories. They were open to use any approach, be it only a machine learning approach, as you mentioned, data science is not just machine learning. It's a, it's a sequence of many tasks. "
22:47,Sanyam Bhutani,Yeah. 
22:47,Shivam Bansal,So that's what something which was required in this competition.
22:50,Sanyam Bhutani,"I think that's also where many people get confused is that you're not using AI to replace a human, you're using software, I think in this case to replace the hiring pipeline or;"
23:00,Shivam Bansal,"It's more about making your strategies more effective, more data driven. So companies have been running their businesses since decades. But mostly that is being through knowledge and their experiences. What data scientists do when they come into picture is they improve those experiences they improve those, those decisions by giving them the right insights, right predictions from the data sets, because that is something which I believe should, everyone should be aware of. And data science is not just replacing those 20-30 experienced people but assisting them with data science metrics."
23:37,Sanyam Bhutani,"That's good, it is, are you a fan of the human in the loop concept or the AI concept? So;"
23:44,Shivam Bansal,"So in my opinion, I believe that humans are definitely one important piece for any project, relying only on AI to say all, take all the decisions may not give us the best possible results, they may create some implicit bias. It's good, good to have humans in the loop? "
24:03,Sanyam Bhutani,"Got it, also you mentioned about all of this knowledge. So could you tell us more about what sort of research for you, or what sort of background study for you went into the competition while you were competing for this?"
24:15,Shivam Bansal,"Yeah, so I structured my entire solution in a series of five to six steps, in which the first step was doing all the comprehensive research, reading all about why companies struggle in getting not diverse candidates, you know, what is the meaning of effective recruitment strategy? What is diversity hiring, what are the kind of implicit bias so I added more than 10 research papers on these different ideas. I read more than 50 blog posts and articles which were available on the internet. So one whole week I spent into just getting the more business insights, getting the more ideas about what this competition is actually talking about. "
24:55,Sanyam Bhutani,"Got it. Also, like people tend to just jump into competition, submit to the leaderboard right away, which is not possible in this. So what do you think of like, how should it be played for understanding the problem versus getting a baseline ready, versus adding features? "
